{"access":"public","created":"2026-09-12","creators":["ReproHPC contributors"],"dataset_id":"demo","description":"Twelve generated, non-human grayscale fixtures; engineering validation only.","doi":null,"license":"CC0-1.0","manifest_sha256":"1d1e4f528d832d05d8c82767f1ae05d8102a0a8c3cb398b838f382411c3d4fc6","modality":"synthetic grayscale imaging","schema_version":"1.0.0","source":"https://github.com/seedyjahateh/ReproHPC","species":"not_applicable","title":"ReproHPC synthetic geometry demo","version":"1.0.0"}
