{"access":"public","created":"2026-09-21","creators":["Tom Schonberg","Christopher Trepel","Craig Fox","Russell A. Poldrack"],"dataset_id":"ds000001","description":"T1-weighted anatomical MRI of 5 subjects (sub-01, sub-02, sub-03, sub-04, sub-05) from OpenNeuro ds000001 version 1.0.0, unmodified. Defaced by the dataset's publishers.","doi":"10.18112/openneuro.ds000001.v1.0.0","license":"CC0-1.0","manifest_sha256":"49011481a016aae75b4c904f0e3d9fc21c898fc9321988b92dda92703834417b","modality":"MRI, T1-weighted anatomical","schema_version":"1.0.0","source":"https://openneuro.org/datasets/ds000001/versions/1.0.0","species":"Homo sapiens","title":"Balloon Analog Risk-taking Task (ds000001), T1w anatomicals","version":"1.0.0"}
